{
  "$schema": "https://raw.githubusercontent.com/sanghyeonKim0201/sh-ui/live/packages/cli/sh-ui.schema.json",
  "platform": "react",
  "cssFramework": "plain",
  "theme": {
    "base": "neutral",
    "radius": "md",
    "mode": "light-dark"
  },
  "paths": {
    "tokens": "src/shared/styles/tokens.css",
    "cssEntry": "app/globals.css",
    "styles": "src/shared/styles",
    "components": "src/shared/ui",
    "utils": "src/shared/lib/utils.ts"
  },
  "aliases": {
    "components": "@/src/shared/ui",
    "utils": "@/src/shared/lib/utils",
    "ui": "@/src/shared/ui"
  }
}
