{
  "$schema": "https://raw.githubusercontent.com/sanghyeonKim0201/sh-ui/live/packages/cli/sh-ui.schema.json",
  "platform": "react",
  "cssFramework": "plain",
  "paths": {
    "components": "src/components",
    "hooks": "src/hooks",
    "utils": "src/lib/utils.ts",
    "styles": "src/styles"
  },
  "aliases": {
    "components": "@workspace/ui-core/components",
    "hooks": "@workspace/ui-core/hooks",
    "utils": "@workspace/ui-core/lib/utils",
    "ui": "@workspace/ui-core/components"
  }
}
